data_id,iso,event_id_cnty,event_id_no_cnty,event_date,year,time_precision,event_type,sub_event_type,actor1,assoc_actor_1,inter1,actor2,assoc_actor_2,inter2,interaction,region,country,admin1,admin2,admin3,location,latitude,longitude,geo_precision,source,source_scale,notes,fatalities,timestamp,iso3
9800741,422,LBN14430,14430,2023-01-25,2023,1,Protests,Peaceful protest,Protesters (Lebanon),,6,,,0,60,Middle East,Lebanon,Akkar,Akkar,,El Aabde,34.5169,35.9683,1,National News Agency Lebanon,National,"On 25 January 2023, protesters presumably stood on the road at El Aabde intersection (Akkar) to block it. Nationwide demonstrations continued for a second consecutive day, against the worsening living and economic conditions, and the record depreciation of the national currency against the US dollar. [size=no report]",0,1675094683,LBN
9800742,422,LBN14431,14431,2023-01-25,2023,1,Protests,Peaceful protest,Protesters (Lebanon),,6,,,0,60,Middle East,Lebanon,North,Al Miniyeh Al Danniyeh,,Beddawi,34.4469,35.8678,1,National News Agency Lebanon,National,"On 25 January 2023, protesters used their cars and trucks to block both sides of the new highway intersection in Beddawi (Al Miniyeh Al Danniyeh). Nationwide demonstrations continued for a second consecutive day, against the worsening living and economic conditions, and the record depreciation of the national currency against the US dollar. [size=no report]",0,1675094683,LBN
9800744,422,LBN14433,14433,2023-01-25,2023,1,Protests,Peaceful protest,Protesters (Lebanon),,6,,,0,60,Middle East,Lebanon,Mount Lebanon,Al Matn,,Jdaidet,33.8906,35.5664,1,National News Agency Lebanon,National,"On 25 January 2023, protesters from the Rwayset neighborhood stood on the road facing Al Kataeb office in Jdaidet (Al Matn). Nationwide demonstrations continued for a second consecutive day, against the worsening living and economic conditions, and the record depreciation of the national currency against the US dollar. [size=no report]",0,1675094683,LBN
9800746,422,LBN14435,14435,2023-01-25,2023,1,Protests,Peaceful protest,Protesters (Lebanon),,6,,,0,60,Middle East,Lebanon,Al Nabatieh,Bint Jbeil,,Mazraat Aazzeh,33.2877,35.4339,1,National News Agency Lebanon,National,"On 25 January 2023, protesters presumably stood on the Rashayya - Masnaa road in Mazraat Aazzeh (Bint Jbeil) to block it. Nationwide demonstrations continued for a second consecutive day, against the worsening living and economic conditions, and the record depreciation of the national currency against the US dollar. [size=no report]",0,1675094683,LBN
9800747,422,LBN14436,14436,2023-01-25,2023,1,Protests,Peaceful protest,Protesters (Lebanon),,6,,,0,60,Middle East,Lebanon,North,Al Miniyeh Al Danniyeh,,Kfar Chellane,34.4261,35.9867,1,National News Agency Lebanon,National,"On 25 January 2023, protesters presumably stood on the Danniyeh - Tripoli road in Kfar Chellane (Al Miniyeh Al Danniyeh) to block it. Nationwide demonstrations continued for a second consecutive day, against the worsening living and economic conditions, and the record depreciation of the national currency against the US dollar. [size=no report]",0,1675094683,LBN
9800748,422,LBN14437,14437,2023-01-25,2023,1,Protests,Peaceful protest,Protesters (Lebanon),,6,,,0,60,Middle East,Lebanon,Bekaa,Zahle,,Ablah,33.8708,35.9681,1,National News Agency Lebanon,National,"On 25 January 2023, protesters presumably stood on the road at Ablah intersection (Zahle) to block it. Nationwide demonstrations continued for a second consecutive day, against the worsening living and economic conditions, and the record depreciation of the national currency against the US dollar. [size=no report]",0,1675094683,LBN
9800749,422,LBN14438,14438,2023-01-25,2023,1,Protests,Peaceful protest,Protesters (Lebanon),,6,,,0,60,Middle East,Lebanon,Mount Lebanon,Baabda,,Baabda,33.8339,35.5442,1,National News Agency Lebanon,National,"On 25 January 2023, relatives of the Beirut Port Blast victims, held a protest outside the chief prosecutor's house in Baabda (Baabda), against his recent decisions to summon the judge overseeing the Beirut Port Blast case, and for releasing the Beirut Port Blast detainees. [size=no report]",0,1675094683,LBN
9800751,422,LBN14440,14440,2023-01-25,2023,1,Protests,Peaceful protest,Protesters (Lebanon),,6,,,0,60,Middle East,Lebanon,South,Sayda,,Ansariyeh,33.4128,35.2792,1,National News Agency Lebanon,National,"On 25 January 2023, protesters presumably stood on the road at Ansariyeh junction (Sayda) to block it. Nationwide demonstrations continued for a second consecutive day, against the worsening living and economic conditions, and the record depreciation of the national currency against the US dollar. [size=no report]",0,1675094683,LBN
9800752,422,LBN14441,14441,2023-01-25,2023,1,Protests,Peaceful protest,Protesters (Lebanon),,6,,,0,60,Middle East,Lebanon,Mount Lebanon,Keserwan,,Jounieh,33.9808,35.6178,1,National News Agency Lebanon,National,"On 25 January 2023, protesters presumably stood on the road near Soldini bridge in Jounieh (Keserwan) to block it. Nationwide demonstrations continued for a second consecutive day, against the worsening living and economic conditions, and the record depreciation of the national currency against the US dollar. The protesters also voiced their support to the judge overseeing the Beirut Port Blast case. [size=no report]",0,1675094683,LBN
9800754,422,LBN14443,14443,2023-01-25,2023,1,Protests,Peaceful protest,Protesters (Lebanon),,6,,,0,60,Middle East,Lebanon,Mount Lebanon,Baabda,,Burj el Barajneh,33.8475,35.5033,1,An-Nahar; El Nashra,National,"On 25 January 2023, protesters presumably stood on the roads at Kafaat street and outside Al Rassoul hospital in Burj el Barajneh (Baabda) to block them. Nationwide demonstrations continued for a second consecutive day, against the worsening living and economic conditions, and the record depreciation of the national currency against the US dollar. [size=no report]",0,1675094683,LBN
9800756,422,LBN14445,14445,2023-01-25,2023,1,Protests,Peaceful protest,Protesters (Lebanon),,6,,,0,60,Middle East,Lebanon,Bekaa,Zahle,,Taalabaya,33.8136,35.8644,1,El Nashra,National,"On 25 January 2023, protesters presumably stood on the main road in Taalabaya (Zahle) to block it. Nationwide demonstrations continued for a second consecutive day, against the worsening living and economic conditions, and the record depreciation of the national currency against the US dollar. [size=no report]",0,1675094683,LBN
9800757,422,LBN14446,14446,2023-01-25,2023,1,Protests,Peaceful protest,Protesters (Lebanon),,6,,,0,60,Middle East,Lebanon,South,Tyr,,Tyr,33.2733,35.1939,2,El Nashra,National,"On 25 January 2023, protesters presumably stood on the Tyr - Naqoura road near Tyr (Tyr) to block it. Nationwide demonstrations continued for a second consecutive day, against the worsening living and economic conditions, and the record depreciation of the national currency against the US dollar. [size=no report]",0,1675094683,LBN
9800758,422,LBN14447,14447,2023-01-25,2023,1,Protests,Peaceful protest,Protesters (Lebanon),,6,,,0,60,Middle East,Lebanon,South,Tyr,,Ech Chehabiye,33.2431,35.3819,1,El Nashra,National,"On 25 January 2023, protesters presumably stood on the road in Ech Chehabiye (Tyr) to block it. Nationwide demonstrations continued for a second consecutive day, against the worsening living and economic conditions, and the record depreciation of the national currency against the US dollar. [size=no report]",0,1675094683,LBN
9800759,422,LBN14448,14448,2023-01-25,2023,1,Protests,Peaceful protest,Protesters (Lebanon),,6,,,0,60,Middle East,Lebanon,South,Tyr,,Burj Shemali,33.2626,35.2388,1,El Nashra,National,"On 25 January 2023, protesters presumably stood on the road at the entrance of Burj Shemali (Tyr) to block it. Nationwide demonstrations continued for a second consecutive day, against the worsening living and economic conditions, and the record depreciation of the national currency against the US dollar. [size=no report]",0,1675094683,LBN
9800763,422,LBN14452,14452,2023-01-25,2023,1,Protests,Peaceful protest,Protesters (Lebanon),,6,,,0,60,Middle East,Lebanon,Akkar,Akkar,,Nahr el Bared,34.5133,35.9597,1,An-Nahar,National,"On 25 January 2023, protesters presumably stood on the road at the Nahr el Bared bridge (Akkar) to block it. Nationwide demonstrations continued for a second consecutive day, against the worsening living and economic conditions, and the record depreciation of the national currency against the US dollar. The army intervened to contain scuffles between the protesters and several by passers. [size=no report]",0,1675094683,LBN
9800849,275,PSE31142,31142,2023-01-25,2023,1,Protests,Peaceful protest,Protesters (Palestine),Refugees/IDPs (Palestine),6,,,0,60,Middle East,Palestine,West Bank,Jenin,,Jenin - Mukhayyam Jenin,32.4605,35.2882,1,Dunia Al Watan; Palestine News and Information Agency,National,"On 25 January 2023, Palestinians marched in Jenin - Mukhayyam Jenin refugee camp (Jenin, West Bank) following the killing of a Palestinian from the camp who attempted to carry out a stabbing attack at an Israeli military post near Jit and Kedumim. Protesters called for national unity. [size=no report]",0,1675094683,PSE
9800949,792,TUR28671,28671,2023-01-25,2023,1,Protests,Peaceful protest,Protesters (Turkey),HDP: Peoples Democratic Party; Government of Turkey (2016-),6,,,0,60,Middle East,Turkey,Sirnak,Silopi,,Silopi,37.2438,42.4634,1,ANF News; Mezopotamya Agency,National-International,"On 25 January 2023, protesters staged a demonstration in front of HDP office is Silopi, Sirnak, to demand justice for two people, including former HADEP (People's Democracy Party) district chair, who have been disappeared on 25 January 2001, while under the under the custody of police forces. HDP members and executives, including HDP Sirnak MP, attended the protest [size=no report]",0,1675094683,TUR
9800986,792,TUR28708,28708,2023-01-25,2023,1,Protests,Peaceful protest,Protesters (Turkey),Muslim Group (Turkey),6,,,0,60,Middle East,Turkey,Denizli,Merkezefendi,,Selcuk Bey,37.7887,29.0294,1,Beyaz Gazete,National,"On 25 January 2023, protesters, including conservative/Muslim groups, staged a demonstration at the '15 Temmuz Sehitler Square' in Selcuk Bey neighborhood of Merkezefendi, Denizli, to protest in response to a right-wing politician who earlier set fire to the Quran at a rally outside the Turkish embassy building in Stockholm. [size=no report]",0,1675094683,TUR
9800988,792,TUR28710,28710,2023-01-25,2023,1,Protests,Peaceful protest,Protesters (Turkey),Muslim Group (Turkey),6,,,0,60,Middle East,Turkey,Elazig,Elazig,,Elazig,38.6743,39.2232,1,Beyaz Gazete,National,"On 25 January 2023, a Muslim group staged a demonstration in front of Izzetpasa Mosque in Elazig town, to protest in response to a right-wing politician who earlier set fire to the Quran at a rally outside the Turkish embassy building in Stockholm. [size=no report]",0,1675094683,TUR
9800989,792,TUR28711,28711,2023-01-25,2023,1,Protests,Peaceful protest,Protesters (Turkey),Muslim Group (Turkey),6,,,0,60,Middle East,Turkey,Karabuk,Karabuk,,Karabuk,41.2049,32.6277,1,Anadolu Agency,National,"On 25 January 2023, members of a Muslim group staged a demonstration in front of Pazaryeri Mosque in Karabuk, to protest in response to a right-wing politician who earlier set fire to the Quran at a rally outside the Turkish embassy building in Stockholm. [size=no report]",0,1675094683,TUR
9801043,12,ALG12362,12362,2023-01-25,2023,1,Protests,Peaceful protest,Protesters (Algeria),Students (Algeria),6,,,0,60,Northern Africa,Algeria,Batna,Seriana,,Seriana,35.6972,6.1878,1,Akher Saa,National,"On 25 January 2023, students from Lazrou held a protest sit-in in front of the municipality of Seriana (Seriana, Batna) denouncing the absence of transport services to their school. [size=no report]",0,1675102875,DZA
9801164,478,MAA1538,1538,2023-01-25,2023,1,Protests,Peaceful protest,Protesters (Mauritania),Labour Group (Mauritania),6,,,0,60,Western Africa,Mauritania,Dakhlet Nouadhibou,Dakhlet Nouadhibou,Nouadhibou,Nouadhibou,20.9434,-17.0380,1,Al Akhbar (Mauritania),National,"On 25 January 2023, hundreds of sailors at a multinational company held a protest sit-in in Nouadhibou (Dakhlet Nouadhibou, Dakhlet Nouadhibou) to denounce their dismissal. [size=hundreds]",0,1675102875,MRT
9801219,504,MOR6950,6950,2023-01-25,2023,1,Protests,Peaceful protest,Protesters (Morocco),Al Adl Wa Al Ihssane; Muslim Group (Morocco),6,,,0,60,Northern Africa,Morocco,Fes-Meknes,Meknes,Meknes,Meknes,33.9000,-5.5500,1,Al Jamaa,National,"On 25 January 2023, Al Adl Wa Al Ihssane activists held a protest sit-in in front of the tribunal of Meknes (Meknes, Fes-Meknes) during the trial of one of the movement's leader arrested on adultery charges calling for his liberation. [size=no report]",0,1675102875,MAR
9801242,566,NIG29667,29667,2023-01-25,2023,1,Protests,Peaceful protest,Protesters (Nigeria),Labour Group (Nigeria),6,,,0,60,Western Africa,Nigeria,Lagos,Lagos Island,,Lagos,6.4531,3.3958,2,Sahara Reporters,Regional,"On 25 January 2023, staff of Egbin power plant protested and blocked the entrance of the plant over claims of poor working conditions and welfare packages. Location coded to Lagos (Lagos Island, Lagos). [size=no report]",0,1675102875,NGA
9801247,566,NIG29672,29672,2023-01-25,2023,1,Protests,Peaceful protest,Protesters (Nigeria),,6,,,0,60,Western Africa,Nigeria,Lagos,Ajeromi,,Ajegunle,6.4568,3.3415,1,Sahara Reporters,Regional,"On 25 January 2023, residents of Ajegunle protested in Ajegunle (Ajeromi, Lagos) and demanded the release of their leader and nine others that were arrested while protesting [coded separately]. [size=no report]",0,1675102875,NGA
9801248,566,NIG29673,29673,2023-01-25,2023,1,Protests,Peaceful protest,Protesters (Nigeria),,6,,,0,60,Western Africa,Nigeria,Lagos,Eti-Osa,,Ikoyi,6.4561,3.4422,2,Sahara Reporters,Regional,"On 25 January 2023, some protesters protested at the office of INEC in Eti-Osa LGA, coded to Ikoyi (Eti-Osa, Lagos) over the failure to receive their permanent voters card from the commission. [size=no report]",0,1675102875,NGA
9801309,566,NIG29734,29734,2023-01-25,2023,1,Protests,Protest with intervention,Protesters (Nigeria),,6,Police Forces of Nigeria (2015-),,1,16,Western Africa,Nigeria,Lagos,Ajeromi,,Ajegunle,6.4568,3.3415,1,Daily Post (Nigeria),National,"On 25 January 2023, protesters comprised of residents and activists protested in Ajegunle (Ajeromi, Lagos) over claims of outrageous electricity bills and unstable power supply in the local government area. 10 of the protesters were arrested by the police, the police claimed that they were arrested for attacking electricity workers and disturbing public peace. [size=no report]",0,1675102875,NGA
9801377,800,UGA8374,8374,2023-01-25,2023,1,Protests,Peaceful protest,Protesters (Uganda),Students (Uganda),6,,,0,60,Eastern Africa,Uganda,Kampala,Kampala,Nakawa Division,Kyambogo,0.3503,32.6308,1,Daily Monitor (Uganda),National,"On 25 January 2023, a group of government sponsored students protested against the delayed payment of their first semester food and living allowance at Kyambogo University (Kampala, Kampala). [size=no report]",0,1675102876,UGA
9801430,340,HND5483,5483,2023-01-25,2023,1,Protests,Peaceful protest,Protesters (Honduras),Students (Honduras),6,,,0,60,Central America,Honduras,Cortes,San Pedro Sula,San Pedro Sula,San Pedro Sula,15.5042,-88.0250,1,La Prensa (Honduras),National,"On 25 January 2023, in San Pedro Sula, Cortes, a group of journalism students protested in a classroom of the National Autonomous University of Honduras in the Sula Valley (UNAH-VS). They demanded the improvement of facilities of the university and the hiring of more teachers. [size=no report]",0,1675106287,HND
9801431,340,HND5484,5484,2023-01-25,2023,1,Protests,Peaceful protest,Protesters (Honduras),FNRP: National Front of Popular Resistance; Women (Honduras),6,,,0,60,Central America,Honduras,Francisco Morazan,Distrito Central,Distrito Central,Tegucigalpa,14.0818,-87.2068,1,El Heraldo (Honduras),National,"On 25 January 2023, in Tegucigalpa, Francisco Morazan, members of the National Popular Resistance Front (FNRP) protested at the capital's Central Park demanding a transparency in the ongoing election of the magistrates of the Supreme Court of Justice (CSJ) for the 2023-2030 period. Meanwhile members of various feminist organizations made similar demands, in addition to also calling for gender equality in the composition of the new court, in a protest in front of the National Congress (CN). [size=no report]",0,1675106287,HND
9801658,484,MEX70004,70004,2023-01-25,2023,1,Protests,Peaceful protest,Protesters (Mexico),Labour Group (Mexico),6,,,0,60,North America,Mexico,Guerrero,Acapulco de Juarez,,Acapulco de Juarez,16.8619,-99.8866,1,El Sol de Acapulco,Subnational,"On 25 January 2023, in Acapulco de Juarez, Guerrero, administrative and educational workers of the Single Union of Public Servants of the State of Guerrero (SUSPEG) marched along Avenida Miguel Aleman coast and started a sit-in at the finance offices to demand an increase in their salary according to their level and category area, among other demands. [size=no report]",0,1675106288,MEX
9801660,484,MEX70006,70006,2023-01-25,2023,1,Protests,Peaceful protest,Protesters (Mexico),Labour Group (Mexico),6,,,0,60,North America,Mexico,Guerrero,Acapulco de Juarez,,Acapulco de Juarez,16.8619,-99.8866,1,El Sol de Acapulco,Subnational,"On 25 January 2023, in Acapulco de Juarez, Guerrero, retirees and pensioners members of the Inter-union Commission of Civil Associations held a protest to demand a hearing with the mayor. The protesters requested to know the location of the land where the new State Social Security Institute (ISSSTE) hospital will be built. [size=no report]",0,1675106288,MEX
9801661,484,MEX70007,70007,2023-01-25,2023,1,Protests,Peaceful protest,Protesters (Mexico),Students (Mexico),6,,,0,60,North America,Mexico,Guerrero,Acapulco de Juarez,,Acapulco de Juarez,16.8619,-99.8866,1,El Sol de Acapulco,Subnational,"On 25 January 2023, in Acapulco de Juarez, Guerrero, students of the 'Raul Isidro Burgos de Ayotzinapa' Normal Rural School blocked the Caleta road to demand justice for the 43 missing students. This event was to commemorate another month of the disappearance of students in Iguala. [size=no report]",0,1675106288,MEX
9801666,484,MEX70012,70012,2023-01-25,2023,1,Protests,Peaceful protest,Protesters (Mexico),,6,,,0,60,North America,Mexico,Veracruz de Ignacio de la Llave,Alvarado,,Buen Pais,18.8224,-95.8505,1,Imagen del Golfo,Subnational,"On 25 January 2023, in Buen Pais, Veracruz, people blocked the Alvarado - Veracruz highway with stones and bonfires to protest against the lack of electricity service. [size=no report]",0,1675106288,MEX
9801671,484,MEX70017,70017,2023-01-25,2023,1,Protests,Peaceful protest,Protesters (Mexico),Health Workers (Mexico),6,,,0,60,North America,Mexico,Guerrero,Chilpancingo de los Bravo,,Chilpancingo de los Bravo,17.5516,-99.5011,1,El Sol de Acapulco,Subnational,"On 25 January 2023, in Chilpancingo de los Bravo, Guerrero, around 20 workers of the Raymundo Abarca Alarcon General Hospital took over the facilities to demand the dismissal of the head of the nursery department. [size=around 20]",0,1675106288,MEX
9801672,484,MEX70018,70018,2023-01-25,2023,1,Protests,Peaceful protest,Protesters (Mexico),Labour Group (Mexico),6,,,0,60,North America,Mexico,Guerrero,Chilpancingo de los Bravo,,Chilpancingo de los Bravo,17.5516,-99.5011,1,El Sol de Acapulco,Subnational,"On 25 January 2023, in Chilpancingo de los Bravo, Guerrero, more than 1000 workers of the Civil Protection and High Schools blocked the Autopista del Sol around the Government Palace to demand a meeting with the state government to express them their demands, including the payment of their retirement bonuses. [size=more than 1000]",0,1675106288,MEX
9801673,484,MEX70019,70019,2023-01-25,2023,1,Protests,Peaceful protest,Protesters (Mexico),Teachers (Mexico),6,,,0,60,North America,Mexico,Guerrero,Chilpancingo de los Bravo,,Chilpancingo de los Bravo,17.5516,-99.5011,1,El Sol de Acapulco,Subnational,"On 25 January 2023, in Chilpancingo de los Bravo, Guerrero, teachers of the 'Rafael Ramirez' Normal School blocked Avenida Ruffo Figueroa to demand an audience with the head of the unit. The protesters claimed that there are a series of obstacles for eight of their colleagues to be beneficiaries of an incentive. [size=no report]",0,1675106288,MEX
9801674,484,MEX70020,70020,2023-01-25,2023,1,Protests,Peaceful protest,Protesters (Mexico),Teachers (Mexico),6,,,0,60,North America,Mexico,Guerrero,Chilpancingo de los Bravo,,Chilpancingo de los Bravo,17.5516,-99.5011,1,El Sol de Acapulco,Subnational,"On 25 January 2023, in Chilpancingo de los Bravo, Guerrero, more than 200 teachers and parents blocked the Autopista del Sol to demand the payment for 16 workers of the Heberto Castillo school. [size=more than 200]",0,1675106288,MEX
9801681,484,MEX70027,70027,2023-01-25,2023,1,Protests,Peaceful protest,Protesters (Mexico),,6,,,0,60,North America,Mexico,Oaxaca,Cosoltepec,,Cosoltepec,18.1417,-97.7903,1,Quadratin Oaxaca,Subnational,"On 25 January 2023, in Cosoltepec, Oaxaca, a group of residents held a protest to request the validation of their municipal authority. There is no more information about the motive of the protest. [size=no report]",0,1675106288,MEX
9801683,484,MEX70029,70029,2023-01-25,2023,1,Protests,Peaceful protest,Protesters (Mexico),,6,,,0,60,North America,Mexico,Morelos,Cuernavaca,,Cuernavaca,18.9218,-99.2349,1,Diario de Morelos,National,"On 25 January 2023, in Cuernavaca, Morelos, residents of different neighbourhoods held a protest and marched from El Vergel to the City Hall against the lack of works, infrastructures, and services provided by the mayor. [size=no report]",0,1675106288,MEX
9801690,484,MEX70036,70036,2023-01-25,2023,1,Protests,Peaceful protest,Protesters (Mexico),,6,,,0,60,North America,Mexico,Puebla,Puebla,,Heroica Puebla de Zaragoza,19.0440,-98.1975,1,E-Consulta,Subnational,"On 25 January 2023, in Heroica Puebla de Zaragoza, Puebla, a group of land owners from San Baltazar Campeche held a protest around Ciudad Universitaria (CU) to demand the payment for the expropriated land where the university campus of the Meritorious Autonomous University of Puebla (BUAP) was built. [size=no report]",0,1675106288,MEX
9801694,484,MEX70040,70040,2023-01-25,2023,1,Protests,Peaceful protest,Protesters (Mexico),,6,,,0,60,North America,Mexico,Nuevo Leon,Monterrey,,Monterrey,25.6647,-100.3110,1,Milenio,National,"On 25 January 2023, in Monterrey, Nuevo Leon, dozens of residents of Colonia Vidriera held a protest and blocked Avenida Ruiz Cortines against the lack of water service. [size=dozens]",0,1675106288,MEX
9801695,484,MEX70041,70041,2023-01-25,2023,1,Protests,Peaceful protest,Protesters (Mexico),Teachers (Mexico),6,,,0,60,North America,Mexico,Veracruz de Ignacio de la Llave,Orizaba,,Orizaba,18.8510,-97.0989,1,Imagen del Golfo,Subnational,"On 25 January 2023, in Orizaba, Veracruz, for the second day in a row, parents and teachers took over the facilities of the 'Nicolas Bravo' primary school to demand the immediate departure of a fourth grade teacher, as they accuse her for acts of verbal and emotional abuse towards the teaching and management staff. [size=no report]",0,1675106288,MEX
9801696,484,MEX70042,70042,2023-01-25,2023,1,Protests,Peaceful protest,Protesters (Mexico),Labour Group (Mexico),6,,,0,60,North America,Mexico,Coahuila de Zaragoza,Muzquiz,,Palau,27.8923,-101.4231,1,La Prensa de Monclova,Subnational,"On 25 January 2023, in Palau, Coahuila, around 50 former workers took over the offices of the MINOSA company to protest against the lack of payment of their owed settlements. [size=around 50]",0,1675106288,MEX
9801698,484,MEX70044,70044,2023-01-25,2023,1,Protests,Peaceful protest,Protesters (Mexico),,6,,,0,60,North America,Mexico,Oaxaca,San Blas Atempa,,Puente Madera,16.3738,-95.1813,1,Diario Contra Poder en Chiapas,National,"On 25 January 2023, in Puente Madera, Oaxaca, members of the community assembly gathered to protest against the industrial park of the interoceanic corridor that the federal government intends to built on their common lands in El Pitayal. The people stated that the municipal, state, and federal government want to impose an industrial park above their rights. [size=no report]",0,1675106288,MEX
9801699,484,MEX70045,70045,2023-01-25,2023,1,Protests,Peaceful protest,Protesters (Mexico),CIOAC-JDLD: Independent Central of Agricultural and Peasants Workers; Farmers (Mexico),6,,,0,60,North America,Mexico,Chiapas,San Cristobal de las Casas,,San Cristobal de las Casas,16.7370,-92.6376,1,Diario Contra Poder en Chiapas,Subnational,"On 25 January 2023, in San Cristobal de las Casas, Chiapas, members of the Independent Central of Agricultural Workers and Peasants (CIOAC) marched to demand to the state government the installation of a dialogue table to expresses their demands,. The event was made within the framework of the commemoration of the day of the Political Constitution of the United Mexican States. [size=no report]",0,1675106288,MEX
