data_id,iso,event_id_cnty,event_id_no_cnty,event_date,year,time_precision,event_type,sub_event_type,actor1,assoc_actor_1,inter1,actor2,assoc_actor_2,inter2,interaction,region,country,admin1,admin2,admin3,location,latitude,longitude,geo_precision,source,source_scale,notes,fatalities,timestamp,iso3
9815903,840,USA51589,51589,2023-01-27,2023,1,Protests,Peaceful protest,Protesters (United States),BLM: Black Lives Matter,6,,,0,60,North America,United States,Tennessee,Shelby,,Memphis,35.1495,-90.0489,1,ABC Action News; Fox35; Liveuamap; MLK50; WREG News Channel 3,Local partner-New media,"On 27 January 2023, at least a few dozen demonstrators marched to the I-55 bridge in Memphis (Tennessee) to call for justice in the case of Tyre Nichols, a Black man who was beaten to death by police in Memphis, Tennessee on 7 January 2023. He was hospitalized and later died on 10 January 2023. An investigation is ongoing into the use of force by police during the arrest and the five officers connected with the incident have since been fired and charged with murder. The demonstrators stopped traffic on the bridge, which crosses over the Mississippi River and into West Memphis, Arkansas, while calling for socioeconomic investment in Brown and Black communities. This demonstration follows the release of body camera footage of the arrest and was held in solidarity with the Black Lives Matter movement. [size=at least a few dozen]",0,1675196778,USA
9815904,840,USA51590,51590,2023-01-27,2023,1,Protests,Peaceful protest,Protesters (United States),,6,,,0,60,North America,United States,Georgia,Muscogee,,Columbus,32.4609,-84.9877,1,WRBL News 3,Subnational,"On 27 January 2023, about 11 people gathered near the Brasfield & Gorrie office in Columbus (Georgia) to memorialize a person who was fatally shot in a shootout with police during a raid of the Weelaunee Forest, also known as the 'Atlanta Forest,' in Atlanta, Georgia on 18 January 2023 and to rally against the construction of an Atlanta Police Department training facility, which has been dubbed 'Cop City' by demonstrators, in the forest. Brasfield & Gorrie is a contractor working with the training facility's construction. More than 120 officers were present but none intervened. [size=about 11]",0,1675196778,USA
9815905,840,USA51591,51591,2023-01-27,2023,1,Protests,Peaceful protest,Protesters (United States),BLM: Black Lives Matter,6,,,0,60,North America,United States,Oregon,Multnomah,,Portland - Northeast,45.5684,-122.6183,1,KOIN6; Oregonian,Subnational,"On 27 January 2023, about 150 to hundreds of demonstrators marched from the Burnside Bridge to downtown Portland and back in Portland - Northeast (Oregon) to call for justice after the release of footage of a Black man who was arrested in Memphis, Tennessee on 7 January 2023 after a traffic stop for reckless driving that escalated into a 'physical confrontation.' He was hospitalized and later died on 10 January 2023. This demonstration was done in solidarity with the Black Lives Matter movement. [size=about 150 to hundreds]",0,1675196778,USA
9815906,840,USA51592,51592,2023-01-27,2023,1,Protests,Peaceful protest,Protesters (United States),BLM: Black Lives Matter,6,,,0,60,North America,United States,California,Sacramento,,Sacramento,38.5799,-121.4962,1,KCRA3; Twitter,New media-Subnational,"On 27 January 2023, about two dozen people marched outside the California state Capitol in Sacramento (California) to call for an end to police violence and justice in recent police violence cases and in solidarity with the Black Lives Matter movement. The demonstration was organized by I Am SAC Foundation following the death of a Black man who was killed after he was beaten by Memphis police officers during a traffic stop on 7 January. [size=about two dozen]",0,1675196778,USA
9815907,840,USA51593,51593,2023-01-27,2023,1,Protests,Peaceful protest,Protesters (United States),BLM: Black Lives Matter; PSL: Party for Socialism and Liberation,6,,,0,60,North America,United States,California,San Diego,,San Diego,32.7174,-117.1660,1,CBS8 (San Diego),Subnational,"On 27 January 2023, people gathered at Waterfront Park in San Diego (California) to call for an end to police violence and justice in recent police violence cases as well as to stand in solidarity with the Black Lives Matter movement. The demonstration was organized by the San Diego Party for Socialism and Liberation and North County Equity and Justice Coalition following the death of a Black man who was killed after he was beaten by Memphis police officers during a traffic stop on 7 January. [size=no report]",0,1675196778,USA
9815908,840,USA51594,51594,2023-01-27,2023,1,Protests,Peaceful protest,Protesters (United States),BLM: Black Lives Matter,6,,,0,60,North America,United States,California,San Francisco,,San Francisco,37.7793,-122.4193,1,KRON4,Subnational,"On 27 January 2023, people marched outside the Westfield Mall in San Francisco (California) to call for an end to police violence and in solidarity with the Black Lives Matter movement. The demonstration came following the death of a Black man who was killed after he was beaten by Memphis police officers during a traffic stop on 7 January. [size=no report]",0,1675196778,USA
9815909,840,USA51595,51595,2023-01-27,2023,1,Protests,Peaceful protest,Protesters (United States),BLM: Black Lives Matter,6,,,0,60,North America,United States,Washington,King,,Seattle,47.6056,-122.3330,1,Seattle Times,Subnational,"On 27 January 2023, about several dozen demonstrators marched from Cal Anderson Park to South Lake Union in Seattle (Washington) to call for justice after the release of footage of the killing of Tyre Nichols, a Black man who was arrested in Memphis, Tennessee on 7 January 2023 after a traffic stop for reckless driving and was then beaten to death by five police officers, who were later charged with murder. He was hospitalized and later died on 10 January 2023. This demonstration was done in solidarity with the Black Lives Matter movement. [size=several dozen]",0,1675196778,USA
9815926,840,USA51612,51612,2023-01-27,2023,1,Protests,Peaceful protest,Protesters (United States),,6,,,0,60,North America,United States,New York,New York,,New York - Manhattan,40.7834,-73.9663,1,News12 (Brooklyn),Subnational,"On 27 January 2023, protesters and members of the New York Immigration Coalition rallied outside of City Hall in New York - Manhattan (New York) to call for more funding for immigrants and asylum seekers. [size=no report]",0,1675196778,USA
9815927,840,USA51613,51613,2023-01-27,2023,1,Protests,Peaceful protest,Protesters (United States),,6,,,0,60,North America,United States,Alabama,Mobile,,Mobile,30.6944,-88.0431,1,Birmingham News,Subnational,"On 27 January 2023, demonstrators marched through Mobile (Alabama), to call for 'pro-life' policies and further abortion restrictions following the overturning of Roe v. Wade with the 2022 Dobbs v. Jackson Women's Health Organization decision. Affiliates of the Women's Resource Center were also present. Some demonstrators also called for specific restrictions on abortion pills. This was part of a nationwide March for Life to call for an end to abortion. [size=no report]",0,1675196778,USA
9815928,840,USA51614,51614,2023-01-27,2023,1,Protests,Peaceful protest,Protesters (United States),BLM: Black Lives Matter,6,,,0,60,North America,United States,New York,New York,,New York - Manhattan,40.7834,-73.9663,1,Audacy; Protest_NYC,Subnational-National,"On 27 January 2023, a small number of protesters marched from Grand Central Station in New York - Manhattan (New York) as part of Day of Rage and Remembrance to call for the closure of Rikers Island and to oppose new prisons. Some protesters also carried signs demanding justice for Tyre Nichols, a Black man, who was stopped for reckless driving and beaten to death by five police officers in Memphis, Tennessee on 10 January, in support of the Black Lives Matter movement, and to call for justice for other victims of police brutality. [size=small]",0,1675196778,USA
9815929,840,USA51615,51615,2023-01-27,2023,1,Protests,Peaceful protest,Protesters (United States),BLM: Black Lives Matter; PSL: Party for Socialism and Liberation,6,,,0,60,North America,United States,North Carolina,Buncombe,,Asheville,35.6010,-82.5540,1,ABC13 (Asheville),Subnational,"On 27 January 2023, about 20 people rallied at Pack Square Park in Asheville (North Carolina) in support of the Black Lives Matter movement and to call for justice and accountability in the death of Tyre Nichols, a Black man, who died after being beaten by Memphis Police Officers on 7 January 2023 following a traffic stop. The protest was held by the Party for Socialism and Liberation in response to the release of police body cam footage in the Memphis incident. [size=about 20]",0,1675196778,USA
9815931,840,USA51617,51617,2023-01-27,2023,1,Protests,Peaceful protest,Protesters (United States),ACLU: American Civil Liberties Union; LGBT (United States),6,,,0,60,North America,United States,Utah,Salt Lake,,Salt Lake City,40.7775,-111.8882,1,Fox13 (Salt Lake City),Subnational,"On 27 January 2023, LGBT+ advocates gathered outside of Governor Spencer Cox's office in Salt Lake City (Utah) to demand that he veto legislation they deem as anti-trans youth. The American Civil Liberties Union of Utah was in attendance. [size=no report]",0,1675196778,USA
9815932,840,USA51618,51618,2023-01-27,2023,1,Protests,Peaceful protest,Protesters (United States),PSL: Party for Socialism and Liberation; BLM: Black Lives Matter,6,,,0,60,North America,United States,Massachusetts,Suffolk,,Boston,42.3591,-71.0639,1,CBS News; WBUR,Subnational-National,"On 27 January 2023, scores of local residents including members of the New Democracy Coalition and the Boston Community Action Team gathered on Boston Common in Boston (Massachusetts) to call for justice and peace after Tyre Nichols, a Black man, was stopped for reckless driving and beaten to death by five police officers in Memphis, Tennessee on 10 January. After that, dozens of protesters and members of the Party for Socialism and Liberation held a march on Tremont Street to demonstrate against 'racist police brutality', in support of the Black Lives Matter movement, and to call for police accountability. The protest followed the public release of body cam footage of the incident. [size=dozens]",0,1675196778,USA
9815933,840,USA51619,51619,2023-01-27,2023,1,Protests,Peaceful protest,Protesters (United States),Government of the United States (2021-); DEM: Democratic Party; Protestant Christian Group (United States); Jewish Group (United States); NAACP: National Association for the Advancement of Colored People; African American Group (United States); Police Forces of the United States (2021-); BLM: Black Lives Matter,6,,,0,60,North America,United States,New York,Erie,,Buffalo,42.8864,-78.8779,1,Channel 2 (Buffalo),Subnational,"On 27 January 2023, protesters, police officers, and elected officials gathered and held a vigil at Buffalo City Hall in Buffalo (New York) to commemorate Tyre Nichols, a Black man, who was stopped for reckless driving and beaten to death by five police officers in Memphis, Tennessee on 10 January, in support of the Black Lives Matter movement, and to call for a peaceful demonstration. The vigil followed the public release of body cam footage of the incident. Common Council President Darius Pridgen (D), City of Buffalo Mayor Bryon Brown (D), NAACP President, a rabbi, and a minister spoke at the vigil. [size=dozens]",0,1675196778,USA
9815934,840,USA51620,51620,2023-01-27,2023,1,Protests,Peaceful protest,Protesters (United States),,6,,,0,60,North America,United States,Oregon,Jackson,,Ashland,42.1945,-122.7094,1,NBC5 (Medford),Subnational,"On 27 January 2023, advocates for the homeless held a 'Let Us Sleep' rally in downtown Ashland (Oregon) to raise awareness of the plight of the unhoused and their inability to legally sleep outside. [size=no report]",0,1675196778,USA
9815935,840,USA51621,51621,2023-01-27,2023,1,Protests,Peaceful protest,Protesters (United States),BLM: Black Lives Matter; PSL: Party for Socialism and Liberation,6,,,0,60,North America,United States,Pennsylvania,Philadelphia,,Philadelphia,39.9525,-75.1636,1,Fox29; Philadelphia Inquirer,Subnational,"On 27 January 2023, around 40 people rallied in front of City Hall in Philadelphia (Pennsylvania) in support of the Black Lives Matter movement and to call 'for an end to police brutality.' The protest was held by the Party for Socialism and Liberation and Stop Killing Us in response to the release of body cam footage in the police beating death of Tyre Nichols, a Black man, in Memphis, TN on 7 January 2023 following a traffic stop. [size=around 40]",0,1675196778,USA
9815936,840,USA51622,51622,2023-01-27,2023,1,Protests,Peaceful protest,Protesters (United States),Fight for 15; Labour Group (United States); SEIU: Service Employees International Union,6,,,0,60,North America,United States,California,Los Angeles,,Los Angeles - Central,34.0693,-118.3118,1,Press-Enterprise,Subnational,"On 27 January 2023, fast food workers and supporters gathered at the headquarters of the Los Angeles Area Chamber of Commerce in Los Angeles - Central (California) to demonstrate support for AB 257, a bill which aims to boost wages and improve working conditions for fast food workers. Members of Fight for 15 and SEIU participated. [size=no report]",0,1675196778,USA
9815937,840,USA51623,51623,2023-01-27,2023,1,Protests,Peaceful protest,Protesters (United States),"Health Workers (United States); Government of the United States (2021-); DEM: Democratic Party; AFSCME: American Federation of State, County and Municipal Employees; Labour Group (United States); AFL-CIO: American Federation of Labor and Congress of Industrial Organizations",6,,,0,60,North America,United States,New Mexico,Santa Fe,,Santa Fe,35.6875,-105.9386,1,Facebook; KOB4,New media-Subnational,"On 27 January 2023, dozens of nurses and medical workers, represented by National Union of Hospital and Health Care Employees District 1199NM (affiliated with the AFSCME and AFL-CIO), gathered outside the State Capitol in Santa Fe (New Mexico) to demand better staffing conditions inside hospitals. State Rep. Eleanor Chavez (D) participated in the rally. [size=dozens]",0,1675196778,USA
9815938,840,USA51624,51624,2023-01-27,2023,1,Protests,Peaceful protest,Protesters (United States),NEA: National Education Association; Teachers (United States); Students (United States); Government of the United States (2021-); DEM: Democratic Party,6,,,0,60,North America,United States,California,Santa Cruz,,Santa Cruz,36.9739,-122.0302,1,Santa Cruz Sentinel,Subnational,"On 27 January 2023, about 50 people gathered outside Pacific Collegiate School in Santa Cruz (California) to call for increased pay for teachers. Members of United PCS (an affiliate of the NEA), students, and State Asm. Gail Pellerin (D) participated in the rally. [size=about 50]",0,1675196778,USA
9815939,840,USA51625,51625,2023-01-27,2023,1,Protests,Peaceful protest,Protesters (United States),,6,,,0,60,North America,United States,Arizona,Maricopa,,Phoenix,33.4492,-112.0741,1,ABC15 Arizona,Subnational,"On 27 January 2023, a group, including members of the Salt River Wild Horse Management Group, gathered at the Arizona State Capitol in Phoenix (California) to demonstrate support for proposed legislation that would protect wild Alpine horses. [size=no report]",0,1675196778,USA
9815940,840,USA51626,51626,2023-01-27,2023,1,Protests,Peaceful protest,Protesters (United States),BLM: Black Lives Matter,6,,,0,60,North America,United States,Missouri,St. Louis city,,Saint Louis,38.6270,-90.1913,1,St. Louis Post-Dispatch,Subnational,"On 27 January 2023, about 30 protesters gathered outside the Saint Louis police headquarters in Saint Louis (Missouri) to demonstrate against the death of Tyre Nichols, who was beaten to death by five Memphis police officers. The protest was organized by ExpectUs, a local human rights organization. [size=about 30]",0,1675196778,USA
9815941,840,USA51627,51627,2023-01-27,2023,1,Protests,Peaceful protest,Protesters (United States),BLM: Black Lives Matter,6,,,0,60,North America,United States,Texas,Dallas,,Dallas,32.7792,-96.8004,1,Dallas Morning News; Kera News,Subnational,"On 27 January 2023, dozens of protesters gathered outside the Dallas police headquarters in Dallas (Texas) to demonstrate against the death of Tyre Nichols, who was beaten to death by five Memphis police officers. The protest was organized by Next Generation Action Network, a local human rights organization. [size=dozens]",0,1675196778,USA
9815942,840,USA51628,51628,2023-01-27,2023,1,Protests,Peaceful protest,Protesters (United States),Teachers (United States); NEA: National Education Association,6,,,0,60,North America,United States,Massachusetts,Middlesex,,Woburn,42.4793,-71.1523,1,WCVB Channel 5,Subnational,"On 27 January 2023, teachers and members of the Woburn Teachers Association (affiliate of NEA) gathered on the Woburn Common in Woburn (Massachusetts) to call for a new contract with higher pay and smaller class sizes. [size=no report]",0,1675196778,USA
9815943,840,USA51629,51629,2023-01-27,2023,1,Protests,Peaceful protest,Protesters (United States),ATU: Amalgamated Transit Union; Labour Group (United States); SEIU: Service Employees International Union,6,,,0,60,North America,United States,Virginia,Loudoun,,Leesburg,39.1157,-77.5636,1,SEIU Virginia 512,Other,"On 27 January 2023, an unreported number of people demonstrated outside of the County Transit Depot in Leesburg (Virginia) to call on Keolis, the contract responsible for public transit in the county, to provide workers a contract which improves health benefits and in opposition to conduct at the company which they say violates workers' rights. Members of SEIU Virginia 512 participated in the picket which was day 17 of their strike organized by ATU Local 689. [size=no report]",0,1675196778,USA
9815944,840,USA51630,51630,2023-01-27,2023,1,Protests,Peaceful protest,Protesters (United States),BLM: Black Lives Matter; PSL: Party for Socialism and Liberation,6,,,0,60,North America,United States,District of Columbia,District of Columbia,,Washington DC - National Mall,38.8875,-77.0364,1,Washington Post,Subnational,"On 27 January 2023, about 75 people demonstrated in Lafayette Square in Washington DC - National Mall (District of Columbia) in support of the Black Lives Matter movement and to call for justice and accountability in the death of Tyre Nichols, a Black man, who died after being beaten by Memphis Police Officers on 7 January 2023 following a traffic stop. The protest was held by the Party for Socialism and Liberation in response to the release of police body cam footage in the Memphis incident. [size=about 75]",0,1675196778,USA
9815945,840,USA51631,51631,2023-01-27,2023,1,Protests,Peaceful protest,Protesters (United States),BLM: Black Lives Matter; African American Group (United States); Palm Collective,6,,,0,60,North America,United States,District of Columbia,District of Columbia,,Washington DC - Northwest,38.9381,-77.0451,1,Dcist; Fox5 (Washington D.C.); Twitter; Washington Post; WUSA9,New media-Subnational,"On 27 January 2023, about 50 people demonstrated at 13th and K St. NW in Washington DC - Northwest (District of Columbia) in support of the Black Lives Matter movement and to call for justice and accountability in the death of Tyre Nichols, a Black man, who died after being beaten by Memphis Police Officers on 7 January 2023 following a traffic stop as well as those killed by the DC Police Department. Members of the DC Justice Lab participated in the demonstration which was organized by Harriet's Wildest Dreams (a Black organization) in response to the release of police body cam footage in the Memphis incident. About 60 people also demonstrated in Black Lives Matter Plaza. Representatives of the Palm Collective participated in this demonstration. [size=about 110]",0,1675196778,USA
9815946,840,USA51632,51632,2023-01-27,2023,1,Protests,Peaceful protest,Protesters (United States),,6,,,0,60,North America,United States,Virginia,Charlottesville,,Charlottesville,38.0293,-78.4767,1,Daily Progress,Subnational,"On 27 January 2023, about a dozen people gathered outside the Charlottesville Albemarle Society for the Prevention of Cruelty to Animals in Charlottesville (Virginia) to call for the resignation of the Executive Director of the organization in response to allegations of animal cruelty and a toxic work environment. [size=about a dozen]",0,1675196778,USA
9800663,376,ISR13608,13608,2023-01-26,2023,1,Protests,Peaceful protest,Protesters (Israel),Students (Israel); Teachers (Israel),6,,,0,60,Middle East,Israel,Tel Aviv,Tel Aviv,Tel Aviv,Tel Aviv,32.0809,34.7806,1,Israel Hayom; Ma'ariv; N12; Walla!News,National,"On 26 January 2023, about 200 students and professors held a protest in Tel Aviv city against the proposed judicial reforms by the Netanyahu-led government, stating 'without democracy, there is no academia.' Protesters blocked major roads during the protest. [size=about 200]",0,1675094683,ISR
9800668,376,ISR13613,13613,2023-01-26,2023,1,Protests,Peaceful protest,Protesters (Israel),Arab Ethnic Group (Israel),6,,,0,60,Middle East,Israel,HaZafon,Yizreel,Nazareth-Tiran Mountains,Nazareth,32.6993,35.3048,1,Arutz Sheva,National,"On 26 January 2023, dozens of Israeli Arabs protested in Nazareth (Yizreel, HaZafon) against Israeli military operations in the West Bank. The protest followed an Israeli military operation in Jenin, during which at least nine Palestinians were killed. [size=dozens]",0,1675094683,ISR
9800669,376,ISR13614,13614,2023-01-26,2023,1,Protests,Peaceful protest,Protesters (Israel),Arab Ethnic Group (Israel),6,,,0,60,Middle East,Israel,HaZafon,Akko,Shefaram,Shefaram,32.8058,35.1690,1,Arutz Sheva; Palestine News and Information Agency,National-Regional,"On 26 January 2023, dozens of Israeli Arabs protested in Shefaram (Akko, HaZafon) against Israeli military operations in the West Bank. The protest followed an Israeli military operation in Jenin, during which at least nine Palestinians were killed. [size=dozens]",0,1675094683,ISR
9800670,376,ISR13615,13615,2023-01-26,2023,1,Protests,Peaceful protest,Protesters (Israel),Arab Ethnic Group (Israel),6,,,0,60,Middle East,Israel,Haifa,Hadera,Alexander Mountain,Umm el Fahm,32.5173,35.1535,1,Arutz Sheva; N12; Palestine News and Information Agency,National-Regional,"On 26 January 2023, dozens of Israeli Arabs protested in Umm el Fahm (Hadera, Haifa) against Israeli military operations in the West Bank. The protest followed an Israeli military operation in Jenin, during which at least nine Palestinians were killed. [size=dozens]",0,1675094683,ISR
9800680,376,ISR13625,13625,2023-01-26,2023,1,Protests,Protest with intervention,Protesters (Israel),Arab Ethnic Group (Israel); Jewish Group (Israel); Government of Israel (2022-); Joint List; Maki: Communist Party of Israel,6,Police Forces of Israel (2022-),,1,16,Middle East,Israel,Haifa,Haifa,Haifa,Haifa,32.8184,34.9885,1,Al-Ittihad; Palestine News and Information Agency,National-Regional,"On 26 January 2023, dozens of Israeli Arabs and Jews, including MKs, held a protest organized by the Communist Party and the Joint List in Haifa city against killing 9 Palestinians in Jenin refugee camp. Israeli police threatened to use force against protesters after raising Palestinian flags, but a Knesset member stopped them. Palestinian sources reported that six protesters were arrested. [size=dozens]",0,1675094683,ISR
9800701,422,LBN14390,14390,2023-01-26,2023,1,Protests,Peaceful protest,Protesters (Lebanon),Labour Group (Lebanon),6,,,0,60,Middle East,Lebanon,North,Tripoli,,El Mina,34.4511,35.8142,1,National News Agency Lebanon,National,"On 26 January 2023, workers from the Tripoli port, held a protest at the port entrance in El Mina (Tripoli), against the non-disbursement of their salaries amid worsening living and economic conditions, and the depreciation of the national currency against the US dollar. [size=no report]",0,1675094683,LBN
9800706,422,LBN14395,14395,2023-01-26,2023,1,Protests,Peaceful protest,Protesters (Lebanon),Labour Group (Lebanon); Lebanon Civil Defense,6,,,0,60,Middle East,Lebanon,Mount Lebanon,Chouf,,Barja,33.6497,35.4428,1,National News Agency Lebanon,National,"On 26 January 2023, municipal police and employees, held a protest outside the municipality in Barja (Chouf), against the non-disbursement of their social aid funds. The protesters closed down the municipality and blocked the entrance with stones and sandbags. [size=no report]",0,1675094683,LBN
9800707,422,LBN14396,14396,2023-01-26,2023,1,Protests,Peaceful protest,Protesters (Lebanon),Muslim Group (Lebanon),6,,,0,60,Middle East,Lebanon,South,Sayda,,Sidon,33.5599,35.3756,1,National News Agency Lebanon,National,"On 26 January 2023, relatives of the Aabra incident detainees marched from the Aisha Umm Al Mumineen Mosque towards Iliya square, then towards Nijmeh square in Sidon (Sayda), in protest against the continued imprisonment of individuals who participated in the Aabra incidents. The protesters demanded their immediate release. Muslim scholars attended the march. [size=no report]",0,1675094683,LBN
9800714,422,LBN14403,14403,2023-01-26,2023,1,Protests,Peaceful protest,Protesters (Lebanon),Teachers (Lebanon),6,,,0,60,Middle East,Lebanon,Mount Lebanon,Keserwan,,Jounieh,33.9808,35.6178,1,National News Agency Lebanon,National,"On 26 January 2023, public school teachers held a protest outside the government serail in Jounieh (Keserwan), to demand a correction of the teachers' salaries, and the provision of medical care and an increase in transportation allowances. [size=no report]",0,1675094683,LBN
